{
  "$ref": "#/definitions/InputManifest",
  "$schema": "http://json-schema.org/draft-07/schema#",
  "definitions": {
    "InputManifest": {
      "additionalProperties": false,
      "properties": {
        "aliasPath": {
          "type": "string"
        },
        "description": {
          "type": "string"
        },
        "esePath": {
          "type": "string"
        },
        "icaoAircraftPath": {
          "type": "string"
        },
        "icaoAirlinesPath": {
          "type": "string"
        },
        "id": {
          "type": "string"
        },
        "loginProfilesPath": {
          "type": "string"
        },
        "name": {
          "type": "string"
        },
        "namespace": {
          "type": "string"
        },
        "outputDir": {
          "type": "string"
        },
        "recatDefinitionPath": {
          "type": "string"
        },
        "sctPath": {
          "type": "string"
        }
      },
      "required": [
        "id",
        "name",
        "description",
        "namespace",
        "sctPath",
        "esePath",
        "loginProfilesPath",
        "icaoAircraftPath",
        "icaoAirlinesPath",
        "aliasPath",
        "outputDir"
      ],
      "type": "object"
    }
  }
}
